title,price,original_price,rating,reviews,link,image,category
Bookshelf Full-Wall Integrated Bookshelf Living Room Floor-Standing Display Storage Organization Cabinet(Large),,,,,N/A,https://m.media-amazon.com/images/I/41hbbyj11pL._AC_UL320_.jpg,other
Bookshelf Wooden Corner Bookcase Living Room Floor-Standing Storage Display Cabinet Bedroom Bookshelf(Large),,,,,N/A,https://m.media-amazon.com/images/I/41orOzrHOrL._AC_UL320_.jpg,electronics
Bookshelf Full-Wall Bookcase Floor-Standing Modular Bookshelf Storage Display Cabinet Drawers Backless Design(Large),,,,,N/A,https://m.media-amazon.com/images/I/41YeVXYu5GL._AC_UL320_.jpg,electronics
Bookshelf Retro Floor-Standing Bookshelf Wall-Mounted Storage Display Shelf Open Multi-Layered(Large),,,,,N/A,https://m.media-amazon.com/images/I/4135Nave-SL._AC_UL320_.jpg,other
Bookshelf Double Glass Door Bookshelf Living Room Floor-Standing Display Cabinet Study Storage Bookcase,,,,,N/A,https://m.media-amazon.com/images/I/41JNywGLULL._AC_UL320_.jpg,electronics
Bookshelf Wooden Floor-Standing Bookcase Glass Doors Drawers Study Bookshelf Storage Cabinet Adjustable Shelves(Large),,,,,N/A,https://m.media-amazon.com/images/I/51QYjJhcFtL._AC_UL320_.jpg,electronics
Bookshelf Freely Combinable Bookcase Retro Minimalist Flip-Up Cabinet Display Storage Adjustable Shelves(Large),,,,,N/A,https://m.media-amazon.com/images/I/41L7jliBPxL._AC_UL320_.jpg,electronics
Bookshelf Floor-Standing Bookshelf Minimalist Storage Display Cabinet Open Compartments Flip-Up Cabinets(Large),,,,,N/A,https://m.media-amazon.com/images/I/41H3+Ed7uLL._AC_UL320_.jpg,other
Bookshelf Modern Minimalist Black Bookshelf Study Display Shelf Bedroom Storage Open Multi-Layered,,,,,N/A,https://m.media-amazon.com/images/I/41w0lxDOBWL._AC_UL320_.jpg,home
Bookshelf Corner Bookcase Home Narrow Gap Storage Tall Cabinet Study Bedroom Bookshelf Drawers Adjustable Shelves,,,,,N/A,https://m.media-amazon.com/images/I/412dMlZJsiL._AC_UL320_.jpg,electronics
Bookshelf Bookcase Study Storage Bookshelf Home Living Room Cabinet Wall-Mounted Drawers Glass Doors,,,,,N/A,https://m.media-amazon.com/images/I/51PZbF0-EoL._AC_UL320_.jpg,electronics
Bookshelf Minimalist Grid Glass-Door Bookcase Retro Display Storage Cabinet Living Room Study Bookshelf Drawers,,,,,N/A,https://m.media-amazon.com/images/I/51bkO27+5gL._AC_UL320_.jpg,electronics
Bookshelf Cute Bookcase Home Living Room Floor-Standing Display Storage Cabinet Wall-Mounted Double Glass Doors(Large),,,,,N/A,https://m.media-amazon.com/images/I/51sJavPe9-L._AC_UL320_.jpg,electronics
"Bookshelf Wall Mounted Bookcase Black with Cabinet Door, Multi Compartment Manmade Board Bookshel Storage, Kitchen Hanging Magazine",,,,,N/A,https://m.media-amazon.com/images/I/41zimkyTYCL._AC_UL320_.jpg,electronics
Bookshelf Wooden Side Cabinet Living Room Storage Display Home Bedroom Bookcase Sliding Door,,,,,N/A,https://m.media-amazon.com/images/I/51YQhoI3LrL._AC_UL320_.jpg,electronics
Bookshelf Floor-Standing Bookshelf Storage Rack Metal-Wood Color Block Open Compartments Wall-Mounted Bookcase,,,,,N/A,https://m.media-amazon.com/images/I/41QCqxzmXtL._AC_UL320_.jpg,electronics
Bookshelf Floor-Standing Bookcase with Arched Glass Door Drawers Adjustable Shelves Display Storage Cabinet,,,,,N/A,https://m.media-amazon.com/images/I/41f6NsKm7AL._AC_UL320_.jpg,electronics
"Bookshelf Black Wall Mounted Book Shelves, Synthetic Board Display Bookshelf, for Living Room Office Organizer Decorative Rack (2 Tier)",,,,,N/A,https://m.media-amazon.com/images/I/51PK4p0f4fL._AC_UL320_.jpg,other
Bookshelf Floor-Standing Bookshelf Slim Gap Cabinet Retro Minimalist Flip-Up Display Glass Doors(Large),,,,,N/A,https://m.media-amazon.com/images/I/41rg2pWVKkL._AC_UL320_.jpg,other
"Bookshelf Wall Mounted Organizer Bookshelf, Manmade Board with Sliding Plastic Door Storage Cabinet, for Office Home Kitchen Display Rack (Black) ﻿(L140xW28xH35 cm)",,,,,N/A,https://m.media-amazon.com/images/I/41CY+d-k2eL._AC_UL320_.jpg,home
"GOX Electronic Organizer Small Travel Cable Organizer Bag for Hard Drives,Cables,USB, SD Card,Black",SGD 34.83,,4.6,59,N/A,https://m.media-amazon.com/images/I/61rnRzScWmL._AC_UY218_.jpg,fashion
"Kaxich Travel Electronics Organizer, Electronics Accessories Bag Portable Cable Organizer Case Waterproof Universal for Adapters Memory Cards, USB Cables (Gray)",SGD 20.54,,4.6,73,N/A,https://m.media-amazon.com/images/I/61+x5c0BFwL._AC_UY218_.jpg,electronics
"bagsmart Electronics Organizer Travel Case, Cable Organiser Pouch, Travel Essentials, Tech Organiser, Travel Accessories Bag for Charging Cable, Flash Drive, Power Bank, USB, Dark Green",SGD 18.83,SGD 22.26,4.6,101,N/A,https://m.media-amazon.com/images/I/81uT+cg+TWL._AC_UY218_.jpg,electronics
"Kaxich Electronics Accessories Bag Travel Gadget Bags Portable Cable Organizer Case Waterproof Universal for Adapters Memory Cards, USB Cables",SGD 17.12,,4.6,482,N/A,https://m.media-amazon.com/images/I/613qITNHMDL._AC_UY218_.jpg,electronics
"Teskyer Electronics Accessories Organiser Bag, Waterproof Cable Organiser Bag, Travel Gadget Bag, Holiday Essentials for Men Women, 8.5 x 5 Inch, Black",SGD 13.35,SGD 18.83,4.5,1K,N/A,https://m.media-amazon.com/images/I/81YB4R1BriL._AC_UY218_.jpg,fashion
"HCFGS Travel Cable Organiser Bag, Electronics Accessories Organizer Bag, Universal Carry Travel Gadget Bag for Cables, Power Bank,USB Drive, Charger Hard Disk (Gray)",SGD 13.09,SGD 16.26,4.6,1.7K,N/A,https://m.media-amazon.com/images/I/71ka1dBhdZL._AC_UY218_.jpg,fashion
"YUNYU Electronics Accessories Organizer Bag, Carry Travel Gadget Bag, Electronics Accessories Bag, Bag Travel Electronics, for USB Cable Drive(Black) (Black)",SGD 11.98,,4.6,79,N/A,https://m.media-amazon.com/images/I/71HBg2agKRL._AC_UY218_.jpg,fashion
Bohemian Beaded Phone Chain 5Pcs with Crystal Lanyard Strap Lightweight Cellphone Decoration for Women Outdoor Activities in Pink White Black Dark Burgundy Grape Purple,SGD 10.83,,,,N/A,https://m.media-amazon.com/images/I/61MGD94Xa-L._AC_UY218_.jpg,electronics
PRETYZOOM Bohemian Beaded Phone Charm Chain 5Pcs with Crystal Lanyard Strap Lightweight Mobile Accessory for Women Express Sentiments in Pink White Black Dark Burgundy Grape Purple,,,,,N/A,https://m.media-amazon.com/images/I/61G10VEoEaL._AC_UY218_.jpg,electronics
Practical Phone Lanyard 11.8 Inch Blue Glass Seed Beads Heart Charm Lightweight 12Mm Width for Women,SGD 8.67,,,,N/A,https://m.media-amazon.com/images/I/51mflNs8s7L._AC_UY218_.jpg,electronics
Mobile Phone Wrist Strap 11.8 Inch Heart-Shaped Beads Blue Glass Seed Beads 12Mm Width for Office and Daily Use,SGD 8.28,,,,N/A,https://m.media-amazon.com/images/I/41uDOpYZ44L._AC_UY218_.jpg,electronics
Phone Lanyard Portable Phone Strap Wrist Rope 12mm White Glass Beads Creative Lovely Design Practical Simple Disassembly Decorative Effects for Colleagues and Friends,SGD 8.22,,,,N/A,https://m.media-amazon.com/images/I/41IeVimK-GL._AC_UY218_.jpg,electronics
"Phone Wrist Strap Lanyard, 2 Pack Adjustable Cellphone Hand Strap Wrist Lanyard with Tether Tab for iPhone and Most Phone Case",SGD 11.98,,4.9,13,N/A,https://m.media-amazon.com/images/I/714+DQ2q3gL._AC_UY218_.jpg,electronics
"20Pcs/lot Black Detachable Buckle Mobile Phone Accessories Pendant Buckle Small Sling Anti-Lost Lanyard Cords Hanging Head Keychains Hooks, Fasteners",SGD 11.98,,5.0,1,N/A,https://m.media-amazon.com/images/I/61ixDDloFDL._AC_UY218_.jpg,electronics
Summer Dark Dragon Satin Jacquard Ice Silk Chinese Traditional Dress Short Sleeve Shirt Men Clothing,SGD 109.80,,,,N/A,https://m.media-amazon.com/images/I/61YCTrxCfKL._AC_UL320_.jpg,fashion
Summer Male Chinese Style Disc Button Retro Short-Sleeved Shirt Men Cotton Linen Tang Dynasty Clothing Shirt,SGD 95.41,,,,N/A,https://m.media-amazon.com/images/I/51YljPOBbTL._AC_UL320_.jpg,fashion
Men Linen Shirts Short Sleeve Chinese Style Mandarin Collar Traditional Kung Fu Tang Casual Social Shirt Clothing,SGD 95.41,,,,N/A,https://m.media-amazon.com/images/I/51EYWBmgwLL._AC_UL320_.jpg,fashion
Okiwam Women's Ok024 Soft,,,4.3,613,N/A,https://m.media-amazon.com/images/I/61zNI5nxQ-L._AC_UL320_.jpg,other
Goth Knitted Harajuku Winter Clothes Women Oversized Sweaters Long Sleeve Top Gothic Kawaii Cartoon Streetwear,,,4.6,283,N/A,https://m.media-amazon.com/images/I/718QweNe1vL._AC_UL320_.jpg,other
"Women's Long Sleeve Mesh Tops for Women, Lace Tops UK Sexy See Through Shirts, Y2K Lace Top Layering Blouses Wedding Blouse Casual Shirt Elegant Clothing Sexy Outfit Band Collar UK",SGD 68.30,,,,N/A,https://m.media-amazon.com/images/I/6164beiuueL._AC_UL320_.jpg,fashion
MixShe Women's Oversized Crewneck Cable Knit Sweaters Fall Fashion 2025,,,4.5,203,N/A,https://m.media-amazon.com/images/I/712hLev9YqL._AC_UL320_.jpg,fashion
CHYRII Womens Oversized Striped T Shirts Short Sleeve Fashion 2026 Casual Crewneck Summer Y2K Clothes,SGD 60.07,,4.5,26,N/A,https://m.media-amazon.com/images/I/71nd3LtI5FL._AC_UL320_.jpg,fashion
"Women's Long Sleeve Mesh Tops for Women, Lace Tops UK Sexy See Through Shirts, Y2K Lace Top Layering Blouses Wedding Blouse Casual Shirt Elegant Clothing Sexy Outfit Band Collar UK",SGD 54.63,,,,N/A,https://m.media-amazon.com/images/I/6164beiuueL._AC_UL320_.jpg,fashion
"Women's Long Sleeve Mesh Tops for Women, Lace Tops UK Sexy See Through Shirts, Y2K Lace Top Layering Blouses Wedding Blouse Casual Shirt Elegant Clothing Sexy Outfit Band Collar UK",SGD 54.63,,,,N/A,https://m.media-amazon.com/images/I/6164beiuueL._AC_UL320_.jpg,fashion
Oyamiki Hoodies for Women Uk Long Sleeve Hooded Sweatshirts Basic Fleece Lined Casual Oversized Hoodie Pullover with Pockets,SGD 53.10,,4.4,31,N/A,https://m.media-amazon.com/images/I/61Uyq8wTbCL._AC_UL320_.jpg,fashion
iGENJUN Womens Ribbed Long Sleeve Crewneck Casual Underscrubs Layer Slim Basic Shirts Fitted Knit Tops,SGD 52.72,,4.4,71,N/A,https://m.media-amazon.com/images/I/81crfctmhZL._AC_UL320_.jpg,fashion
Formal Bolero Crop Shrug Top Goth Y2k Victorian Clothes Women,SGD 51.32,,4.0,1,N/A,https://m.media-amazon.com/images/I/71aDFGDkWFL._AC_UL320_.jpg,other
Goth Dress Punk Gothic Harajuku Summer Black Mini Dress Shirt Women Short Sleeve Emo Clothes Mall Goth Accessories,SGD 51.27,,4.1,472,N/A,https://m.media-amazon.com/images/I/714VTQzKzZL._AC_UL320_.jpg,fashion
Womens Long Sleeve Tops Fall Clothing V Neck Casual Shirts Button Dressy Trendy Blouses Loose Fit Tunic,SGD 49.11,,4.3,392,N/A,https://m.media-amazon.com/images/I/71mrkBx2GbL._AC_UL320_.jpg,fashion
Slyart Handmade Black Canvas Wall Art with Black Aluminum Alloy Outer Frame Modern Abstract Oil Paintings Texture Wall Art for Living Room Bedroom Wall Decor,SGD 270.42,,4.6,31,N/A,https://m.media-amazon.com/images/I/81XUQdOjudL._AC_UL320_.jpg,home
"Wall Art,Modern Creative Geometric Circular Metal Wall Sculptures, 58""×18"" Large Black 3D Metal Wall Art Hanging Sculptures for Living Room Dining Room Bedroom, Home Decor for Apartment Bedroom",SGD 263.31,,4.6,63,N/A,https://m.media-amazon.com/images/I/81HAiwnxARL._AC_UL320_.jpg,home
"Minimalist Abstract Woman Silhouette Metal Line Art - Wall Decor for Bedroom, Gift for Her (Black, 13""x24""|33x60cm)",SGD 224.45,,5.0,2,N/A,https://m.media-amazon.com/images/I/71ykfenKS+L._AC_UL320_.jpg,home
"3D Textured Black and White Abstract Wall Art with Vase, Modern Paintings Artwork for Walls, Minimalist Wall Decor for Living Room Dining Room Bedroom Office Bathroom Home Decoration",SGD 220.56,,4.3,26,N/A,https://m.media-amazon.com/images/I/712FgCgcoCL._AC_UL320_.jpg,home
"Large 4 Pack Gold Wall Art Décor, Minimalist Décor Single Line Art Wall Décor, Real Metal Wall Art, for Kitchen Bedroom Living Room (Black Classic Style, L size 22.5x15.7'')",SGD 178.66,SGD 44.67,4.6,328,N/A,https://m.media-amazon.com/images/I/71AJwOMbzNL._AC_UL320_.jpg,home
"LZAOA Abstract Black Metal Wall Art-3D Textured Metal Wall Sculptures, Minimalist Line Art Decor, 4 Pcs Modern Wall Art, Suitable for Living Room Bedroom Dining Room Study Room - Housewarming (Black",SGD 169.87,SGD 42.48,4.3,16,N/A,https://m.media-amazon.com/images/I/712Y9nIR39L._AC_UL320_.jpg,home
ITrixgan 7 Pieces Black Wall Art Metal Modern Round Large Sunburst Hanging Wall Decor Above Bed TV for Home Office Bedroom Living Room,SGD 154.64,,4.6,127,N/A,https://m.media-amazon.com/images/I/51klel1Br+L._AC_UL320_.jpg,home
"Kunsen Hygroscopic Bedroom Decor Accessories 130x200cm, Grayish Black Modern abstract design for the entrance of living room corridor",SGD 142.18,,,,N/A,https://m.media-amazon.com/images/I/815o8aBuBIL._AC_UL320_.jpg,home
"Abstract Black Metal Wall Art-3D Textured Sculptures,Minimalist Line Art Decor,3 Pcs Modern Wall Art,Suitable for Living room Bedroom Dining Room Study Room - Housewarming (Black Abstract 23"" x 15"")",SGD 142.05,SGD 47.34,4.2,25,N/A,https://m.media-amazon.com/images/I/81DEIBrqKSL._AC_UL320_.jpg,home
sechars Roses with Butterflies Wall Art Fashion Glam Floral Painting Print Framed Canvas Set Black and Pink Bathroom Decor (Pink),SGD 128.08,,,,N/A,https://m.media-amazon.com/images/I/71k21uD4rRL._AC_UL320_.jpg,fashion
"Torre & Tagus Abstract Black and White Vase - 7.25x5.5 Tall Modern Decor Ceramic Vase for Flowers with Stripes - Aesthetic Room Decor for Living Room Shelf, Fireplace Mantel, Entryway Console Table",SGD 117.59,,4.6,243,N/A,https://m.media-amazon.com/images/I/61OyUhjm9FL._AC_UL320_.jpg,other
"16"" Modern Abstract Ribbon Decorative Sculpture, Knot Sculptures,Home Decor,Coffee Table Statues,Dining Living Room Desk Decor（Black）",SGD 104.28,,4.1,7,N/A,https://m.media-amazon.com/images/I/51ppExiTG8L._AC_UL320_.jpg,home
"WINUSD 23in Black Large Abstract Metal Wall Art, 4Pcs Minimalist Modern Single Line Art Wall Decor, 3D Textured Hollow Out Design Wall Sculptures, Metal Artwork for Wall Art for Living Room Kitchen",SGD 99.36,SGD 24.85,4.3,33,N/A,https://m.media-amazon.com/images/I/71J4lsN7TaL._AC_UL320_.jpg,home
"Home Decor Modern Abstract Art Ceramic Statue - 2 PCS Black and Gold Sculptures, Mid Century Modern Decor, Elegant Table Centerpieces for Dining Room, Living Room, Office, Entryway, Bookshelf, Mantel",SGD 93.02,,5.0,4,N/A,https://m.media-amazon.com/images/I/617yqKGfn3L._AC_UL320_.jpg,home
"4 Pieces Abstract Black Metal Flowers Wall Sculptures for Home Decor, Contemporary Floral Wall Art Set, Modern Black Line Wall Hanging Decorations for Bedroom Living Room Bathroom,12 x 17 Inches",SGD 88.33,,4.6,4,N/A,https://m.media-amazon.com/images/I/71LlxW2YcGL._AC_UL320_.jpg,home
